{
  "$schema": "granados/manifest.schema.json",
  "schema_version": 1,
  "dataset_id": "granados2018",
  "status": "metadata_schema_verified_ineligible_current_protocol",
  "custody": {
    "measurement_values_disclosed": false,
    "measurement_statistics_computed": true,
    "models_fit_or_reserved_data_scored": false,
    "raw_files_allowed_for_training": false,
    "training_allowlist": [],
    "protocol_path": "data/native_law_v2/protocol.json",
    "protocol_sha256": "e901d3985b5577d6f846229e1178062414e3220a7307b6d8ee40b0d01e9dffde",
    "export_authorized": false,
    "raw_storage": "data/native_law_v2/granados/sealed/raw_mixed",
    "reservation": "All response measurements are provisionally reserved. No response-bearing projection may be opened by the learner before an explicit verifier protocol approves its whole-experiment source IDs and observation mapping. Metadata and shapes alone may be disclosed.",
    "seal_limit": "Local custodial separation is not encryption or an OS-level boundary against other processes running as the same user. The learner must use an exact projection allowlist, never recursive discovery of this directory.",
    "measurement_statistics_scope": "Baseline means/SDs are evaluated privately only inside the source-defined identity replays requested in the metadata follow-up. No response moments, constants or intermediate projections are released; no models are fitted/scored.",
    "measurement_statistics_disclosed": false
  },
  "sources": [
    {
      "source_id": "catalogue",
      "url": "https://datashare.ed.ac.uk/server/api/core/items/82d65e34-a1a2-4a8d-9bc7-b72d14b80111",
      "local_path": "data/native_law_v2/granados/provenance/repository_item.json",
      "sha256": "00246d9ff14956571fbcd94e82d6aebf363289b3d5537292e9ffb1f86ccc5605",
      "kind": "repository_metadata",
      "verification": "Live API verified; item 82d65e34-a1a2-4a8d-9bc7-b72d14b80111, DOI 10.7488/ds/2214, CC BY 4.0, paper DOI 10.1073/pnas.1716659115."
    },
    {
      "source_id": "bundle",
      "url": "https://datashare.ed.ac.uk/server/api/core/bundles/29a5d553-9aa0-4898-9b2c-d5a010c52628/bitstreams",
      "local_path": "data/native_law_v2/granados/provenance/repository_bundle.json",
      "sha256": "7de6eb6f33ade36c6e4140369dfc895be2425bdcb154fc6337392e8b8fbe3715",
      "kind": "repository_metadata",
      "verification": "Live API verified eight original bitstreams, their UUIDs, byte lengths, MD5 checksums and content links. API IDs, not inconsistent supplementary-figure headings, are authoritative."
    },
    {
      "source_id": "readme",
      "url": "https://datashare.ed.ac.uk/server/api/core/bitstreams/c779e1c9-0b73-4824-8dae-e5f7fc39f212/content",
      "local_path": "data/native_law_v2/granados/provenance/readme_source.txt",
      "sha256": "fbce9f1ec3abbff57ee3c2e1af29cdecfc8122cfe393287954a11776d8724ebf",
      "kind": "repository_readme",
      "verification": "Live README acquired; SHA256 rechecked against the existing metadata candidate and stored with source evidence."
    },
    {
      "source_id": "europe_pmc_lookup",
      "url": "https://www.ebi.ac.uk/europepmc/webservices/rest/search?query=DOI%3A10.1073%2Fpnas.1716659115&format=json&resultType=core",
      "local_path": "data/native_law_v2/granados/provenance/europe_pmc_lookup.json",
      "sha256": "4c3ab110500e7f2f9f6dae7e433d2d285ed13f8a1187ae7790cdbfedcaff652a",
      "kind": "lookup_metadata",
      "verification": "Exact DOI lookup returned PMCID PMC6003323; used structured PMCID to locate the primary archived article."
    },
    {
      "source_id": "primary_article",
      "url": "https://pmc.ncbi.nlm.nih.gov/articles/PMC6003323/",
      "local_path": "data/native_law_v2/granados/sealed/primary_sources/primary_article.html",
      "sha256": "e892b560518d24bb5e6844969af986465b8216eda80059cf75e23afafed338fa",
      "kind": "primary_article",
      "verification": "Primary PMC article; only Materials and Methods and supplement links disclosed. Full source retained in sealed primary_sources."
    },
    {
      "source_id": "primary_supplement",
      "url": "https://pmc.ncbi.nlm.nih.gov/articles/instance/6003323/bin/pnas.1716659115.sapp.pdf",
      "local_path": "data/native_law_v2/granados/sealed/primary_sources/primary_supplement.pdf",
      "sha256": "0e610cbad1ebcdd3954e61fd1f210d1340bc7cdd2b42198ea02b7e8b51a1cd28",
      "kind": "primary_supplement",
      "verification": "Exact PDF link in primary article; 39-page supplement acquired and hashed. SI sections 1.1-1.2.4, Tables 1-3, and 3.1 verified for assay context, replication and normalization. Public excerpt omits the published aggregate calibration outcome; no measurement-figure values were extracted. Full source stays sealed."
    },
    {
      "source_id": "author_processing_code",
      "url": "https://github.com/swainlab/mi-by-decoding",
      "local_path": "data/native_law_v2/granados/provenance/source_code_acquisition.json",
      "sha256": "c47b91e9e596319188ecc13b81b70dd7a4d1e21c7419076d98619b6b330e5fc4",
      "kind": "repository_metadata",
      "verification": "Supplement page 14 links mi-by-decoding; README links DISCO and its GeneralMatlabFunctions submodule. Immutable API blobs were acquired with gh, source hashes checked, and the named normalization helpers used only in the fixed custodial identity replay. No MI/classifier/plotting or model-performance code was executed; no package was installed."
    }
  ],
  "verified_facts": [
    {
      "field": "measurement_semantics",
      "value": "median is median fluorescence over segmented cell pixels; max5 is the mean of the five brightest pixels; nucLoc=max5/median is an image-derived nuclear-localization proxy, not a phosphorylation or kinase-activity assay.",
      "evidence_ids": [
        "readme"
      ],
      "locator": "Description of the data; measurement definitions"
    },
    {
      "field": "time_and_missingness",
      "value": "Rows are cells and columns measurement time points. null means absent cells, not zero. Nominal imaging cadence is 2.5 min. The authors' worked example and linked exporter verify origin as a 1-based frame index; it is not minutes or a calendar timestamp. All 119 raw groups with actual times place that index at the nearest-zero mean relative-time column. Raw files put times/origin under general, except marker data under GFP; normalized fig2 replicates have GFP/origin but no times. A nominal 2.5*(j-origin) grid can be explicitly annotated, not passed off as recovered timestamps or a full-movie acquisition clock.",
      "evidence_ids": [
        "readme",
        "primary_article",
        "primary_supplement"
      ],
      "locator": "README timing definitions; SI 1.2.1, 1.2.4 and 3.1; provenance/source_code/example_script.m:51-70; provenance/source_code/formatCellInf.m:100-128; timing_review.json; metadata_supplement.json origin_and_clock_semantics"
    },
    {
      "field": "documented_replication",
      "value": "fig1 has six Sfp1 carbon-stress biological replicates on different days. fig2_stress_type_expts is explicitly the same first biological replicate also present in fig2_stress_type_replicates; the latter includes an additional biological replicate, not an independent version of rep1.",
      "evidence_ids": [
        "readme"
      ],
      "locator": "fig1_sfp1_replicates.json; fig2_stress_type_expts.json; fig2_stress_type_replicates.json"
    },
    {
      "field": "strain_channels_not_joint_by_default",
      "value": "Single-colour factor strains cannot be joined into co-measured cell vectors. Actual two-colour pairs are Dot6/Msn2, Hog1/Msn2, Mig1/Msn2 and Yap1/Msn2, each under carbon and osmotic stress (8 source groups). README assigns GFP to the first factor and mCherry to the second. Both channels share one general time matrix and matching cell/time shapes within each experiment. No Sfp1 two-colour group is deposited. Explicit persistent cell IDs/channel acquisition offsets are not provided.",
      "evidence_ids": [
        "readme"
      ],
      "locator": "figS19_two_colour_expts.json"
    },
    {
      "field": "independent_nuclear_marker_assay",
      "value": "Nhp6A-mCherry supplies an orthogonal nuclear mask for GFP nucInnerMedian/cytInnerMedian. The Sfp1 marker group contains these fields plus raw nucLoc, median, max5, nucCytRatio and times on matching 60-cell by 91-frame arrays, so same-experiment paired observation validation is supported. It is one biological unit with correlated GFP/segmentation errors, not additional biological replication or an absolute activity assay. Actual marker factors are Dot6, Maf1, Mig1, Sfp1 and Tod6; other experiments lacked the marker. A newly registered paired-sample design is scientifically distinct from the original six-disjoint-support-group requirement, which remains unmet.",
      "evidence_ids": [
        "readme",
        "primary_supplement"
      ],
      "locator": "SI 1.1 and 1.2.3; README nuclear-marker description; inventory_summary.json:201-214; bitstream 0dcc11fc-dcd1-4983-930e-26265b48a0e9"
    },
    {
      "field": "catalogue_heading_discrepancy",
      "value": "README headings say figS2 nuclear marker and figS8 rich-to-rich; actual bundle names are figS1_nuclear_marker_expts.json and figS7_rich_to_rich_expts.json. Use UUIDs 0dcc11fc-dcd1-4983-930e-26265b48a0e9 and f0ff4386-a4a5-40a4-b501-42b3e222e698.",
      "evidence_ids": [
        "readme",
        "bundle"
      ],
      "locator": "File descriptions versus bitstream name/id fields"
    },
    {
      "field": "strain_media_temperature",